{
  "record_type": "sphera.engine-nft",
  "schema_version": "1.0.0",
  "nft_id": {"chain_id": "eip155:1", "contract": "0x1111111111111111111111111111111111111111", "token_id": "42"},
  "ruleset": {"name": "Sphera Core", "version": "1.0.0"},
  "resources": {
    "rule_book_uri": "ipfs://bafybeigdyrulebookexample",
    "player_guide_uri": "ipfs://bafybeigdyplayerguideexample"
  },
  "engine_spec": {
    "uri": "ipfs://bafybeigdyengineexample",
    "sha256": "aaaaaaaaaaaaaaaaaaaaaaaaaaaaaaaaaaaaaaaaaaaaaaaaaaaaaaaaaaaaaaaa"
  },
  "accepted_state_schema_versions": ["1.0.0"],
  "revision": 1,
  "provenance": {
    "created_at": "2026-08-08T00:00:00Z",
    "created_by": "did:key:z6MkSpheraExample",
    "source_uri": "ipfs://bafybeigdysourceengineexample",
    "source_sha256": "bbbbbbbbbbbbbbbbbbbbbbbbbbbbbbbbbbbbbbbbbbbbbbbbbbbbbbbbbbbbbbbb"
  }
}
